{
  "experiment_id": "EXP-005",
  "version": "1.0.0",
  "hypothesis": "Explicit layered spatial roles outperform generic cinematic depth",
  "baseline_prompt": "Create a realistic adult portrait in a refined interior. The subject stands in a dynamic elegant pose, wearing a satin outfit and holding a ceramic vase. Soft directional window light shapes the face. Foreground, midground, and background create depth. Hasselblad camera, 85mm lens, 8K masterpiece, ultra-detailed. Avoid bad anatomy, extra fingers, blur, artifacts, text, watermark, logo.",
  "variants": [
    {
      "id": "control",
      "factor": "layered_depth",
      "operation": "identity"
    },
    {
      "id": "variant",
      "factor": "layered_depth",
      "operation": "replace_literal",
      "old": "Foreground, midground, and background create depth",
      "new": "A blurred foreground doorway frames her; she occupies the midground; the window and distant furniture remain readable in the background"
    }
  ],
  "preserved_dimensions": [
    "subject",
    "environment",
    "lighting",
    "aspect ratio",
    "identity unless factor explicitly tests it"
  ],
  "evaluation_dimensions": [
    "semantic_compliance",
    "aesthetic_quality",
    "technical_defects",
    "layered_depth"
  ],
  "model_target": "gpt-image-2",
  "status": "planned",
  "related_patterns": [
    "composition-layered-depth"
  ]
}
